repo-results-cache/bf16-lowres/marker/mmdetection-readthedocs-io-en-v2.18.0__p0074__bbox.json

{"blocks": [{"bbox": [0.0, 0.0, 612.0, 792.0], "text": "", "type": "Page"}, {"bbox": [491.8009948730469, 91.265625, 540.0000610351562, 102.20135498046875], "text": "CHAPTER", "type": "Text"}, {"bbox": [510.99609375, 112.1484375, 540.0004272460938, 127.127197265625], "text": "TEN", "type": "Text"}, {"bbox": [241.154296875, 165.90234375, 540.0009155273438, 181.921142578125], "text": "TUTORIAL 3: CUSTOMIZE DATA PIPELINES", "type": "SectionHeader"}, {"bbox": [71.12109375, 230.484375, 273.7793273925781, 245.68212890625], "text": "10.1 Design of Data pipelines", "type": "SectionHeader"}, {"bbox": [70.224609375, 263.323974609375, 540.0039672851562, 309.60430908203125], "text": "Following typical conventions, we use Dataset and DataLoader for data loading with multiple workers. Dataset returns a dict of data items corresponding the arguments of models' forward method. Since the data in object detection may not be the same size (image size, gt bbox size, etc.), we introduce a new DataContainer type in MMCV to help collect and distribute data of different size. See here for more details.", "type": "Text"}, {"bbox": [70.5234375, 316.72265625, 540.0031127929688, 351.44830322265625], "text": "The data preparation pipeline and the dataset is decomposed. Usually a dataset defines how to process the annotations and a data pipeline defines all the steps to prepare a data dict. A pipeline consists of a sequence of operations. Each operation takes a dict as input and also output a dict for the next transform.", "type": "Text"}, {"bbox": [70.822265625, 358.875, 540.0030517578125, 381.3352966308594], "text": "We present a classical pipeline in the following figure. The blue blocks are pipeline operations. With the pipeline going on, each operator can add new keys (marked as green) to the result dict or update the existing keys (marked as orange).", "type": "Text"}, {"bbox": [69.8203125, 378.984375, 573.2578125, 535.21875], "text": "", "type": "Figure"}, {"bbox": [71.12109375, 535.2677612304688, 95.24274444580078, 545.2303619384766], "text": "figure", "type": "Text"}, {"bbox": [70.822265625, 552.234375, 487.98828125, 563.1633605957031], "text": "The operations are categorized into data loading, pre-processing, formatting and test-time augmentation.", "type": "Text"}, {"bbox": [72.0, 571.1337585449219, 253.12005615234375, 581.0963592529297], "text": "Here is a pipeline example for Faster R-CNN.", "type": "Text"}, {"bbox": [67.833984375, 585.87890625, 540.580078125, 710.40234375], "text": "img_norm_cfg = dict( mean=[123.675, 116.28, 103.53], std=[58.395, 57.12, 57.375], to_rgb=True) train_pipeline = [ dict(type='LoadImageFromFile'), dict(type='LoadAnnotations', with_bbox=True), dict(type='Resize', img_scale=(1333, 800), keep_ratio=True), dict(type='RandomFlip', flip_ratio=0.5), dict(type='Normalize', **img_norm_cfg), dict(type='Pad', size_divisor=32), dict(type='DefaultFormatBundle'),", "type": "Code"}, {"bbox": [461.9010009765625, 711.94921875, 540.0, 720.45703125], "text": "(continues on next page)", "type": "Text"}, {"bbox": [527.431640625, 741.33984375, 540.0004272460938, 752.1943550109863], "text": "", "type": "PageFooter"}], "doc_id": "mmdetection-readthedocs-io-en-v2.18.0.pdf", "page_index": 74, "pdf_path": "/mmfs1/data/group/ems036/lxu/mpvrdu/.data/mmlongbench/documents/mmdetection-readthedocs-io-en-v2.18.0.pdf", "source": "marker"}

repo-results-cache/parser/mineru/mmdetection-readthedocs-io-en-v2.18.0__dpi200__p0074.md

TUTTORIAL 3: CUSTOMIZE DATA PIPELINES
10.1 Design of Data pipelines
Following typical conventions, we use Dataset and DataLoader for data loading with multiple workers. Dataset
returns a dict of data items corresponding the arguments of models' forward method. Since the data in object detection
may not be the same size (image size, gt bbox size, etc.), we introduce a new DataContainer type in MMCV to help
collect and distribute data of different size. See here for more details.
The data preparation pipeline and the dataset is decomposed. Usually a dataset defines how to process the annotations
and a data pipeline defines all the steps to prepare a data dict. A pipeline consists of a sequence of operations. Each
operation takes a dict as input and also output a dict for the next transform.
We present a classical pipeline in the following figure. The blue blocks are pipeline operations. With the pipeline going
on, each operator can add new keys (marked as green) to the result dict or update the existing keys (marked as orange).
LoadImageFromFile
LoadAnnotations
Resize
RandomFlip
Normalize
Pad
DefaultFormat
Bundle
Collect
{ img:
img_shape:
'ori_shape':
'gt_shape':
'gt_bboxes':
'gt_labels':
'bbox_fields':
} { img:
img_shape:
'ori_shape':
'pad_shape':
'gt_bboxes':
'gt_labels':
'bbox_fields':
'scale':
'scale_xd':
'scale_yd':
'scale_zd':
'keep_ratio':
} { img:
img_shape:
'ori_shape':
'pad_shape':
'gt_bboxes':
'gt_labels':
'bbox_fields':
'scale':
'scale_xd':
'scale_yd':
'scale_zd':
'keep_ratio':
'flip':
'img_norm_cfg':
'scale_xd':
'scale_yd':
'keep_ratio':
'flip':
'img_norm_cfg':
'pad_size':
'pad_size_divisor':
} { img:
img_shape:
'ori_shape':
'pad_shape':
'gt_bboxes':
'gt_labels':
} pipeline
figure
The operations are categorized into data loading, pre-processing, formatting and test-time augmentation.
Here is a pipeline example for Faster R-CNN.
img_norm_cfg = dict(
mean=[123.675, 116.28, 103.53], std=[58.395, 57.12, 57.375], torgb=True)
trainpipeline = [
dict(type='LoadImageFromFile'),
dict(type='LoadAnnotations', with_bbox=True),
dict(type='Resize', img_scale=(1333, 800), keep_ratio=True),
dict(type='RandomFlip', flip_ratio=0.5),
dict(type='Normalize', '*img_norm_cfg'),
dict(type='Pad', size_divisor=32),
dict(type='DefaultFormatBundle'),
(continues on next page)